{"routine_id":"routine-20260615-2018-279ed1","timestamp":"2026-06-15T20:28:35","signal_changes":[{"ticker":"DIVO","direction":"UP","transition":["HOLD","BUY"],"points_delta":3,"driver":"ticker sweep (score 71)"},{"ticker":"IBIT","direction":"UP","transition":["NEUTRAL","HOLD"],"points_delta":13,"driver":"ticker sweep (score 55)"},{"ticker":"MARA","direction":"UP","transition":["CAUTION","NEUTRAL"],"points_delta":4,"driver":"ticker sweep (score 42)"},{"ticker":"SPCE","direction":"UP","transition":["CAUTION","NEUTRAL"],"points_delta":7,"driver":"ticker sweep (score 40)"},{"ticker":"VDY","direction":"UP","transition":["HOLD","BUY"],"points_delta":11,"driver":"ticker sweep (score 77)"},{"ticker":"YNVDA","direction":"DOWN","transition":["CAUTION","AVOID"],"points_delta":-17,"driver":"ticker sweep (score 22)"}],"hard_stops":{},"catalysts":[{"ticker":"SCHF","event":"BoJ rate decision","date":"2026-06-16","value":73},{"ticker":"XEQT","event":"FOMC decision","date":"2026-06-17","value":67},{"ticker":"YNVDA","event":"distribution","date":"2026-06-19","value":22},{"ticker":"XIC","event":"BoC MPR","date":"2026-07-15","value":66},{"ticker":"ZAG","event":"BoC MPR","date":"2026-07-15","value":63},{"ticker":"VDY","event":"BoC decision","date":"2026-07-30","value":77}]}